{
  "contractVersion": "1.0.0",
  "id": "example-attempt-0001",
  "createdAt": "2026-08-28T00:00:00.000Z",
  "observedTranscript": {
    "text": "昨日学校を行きました",
    "engine": "faster-whisper-ctranslate2-nbest",
    "language": "ja",
    "createdAt": "2026-08-28T00:00:00.000Z",
    "sha256": "19b013b1ba864d15bb052995831395c4d7b59a0e79753d9caa2d40f911960bff",
    "metadata": {
      "taskType": "free-response",
      "asrModel": "small",
      "observedCandidateId": "fw-0001",
      "nbestSchemaVersion": "1.0.0",
      "asrAudioPcmSha256": "aaaaaaaaaaaaaaaaaaaaaaaaaaaaaaaaaaaaaaaaaaaaaaaaaaaaaaaaaaaaaaaa",
      "asrModelInputPcmSha256": "aaaaaaaaaaaaaaaaaaaaaaaaaaaaaaaaaaaaaaaaaaaaaaaaaaaaaaaaaaaaaaaa",
      "asrAudioHashFormat": "sha256-float32le-mono-waveform",
      "asrDurationSeconds": 2.4,
      "asrDurationSecondsBeforeVad": 2.4,
      "asrBeamSize": 8,
      "asrReturnedHypotheses": 3
    }
  },
  "normalizedTranscript": {
    "text": "昨日学校に行きました",
    "model": "qwen-local:4b",
    "mode": "rank-only",
    "sourceCandidateId": "fw-0002",
    "reasonCodes": ["context-fit", "japanese-naturalness"],
    "evidence": {
      "selectedCandidateId": "fw-0002",
      "normalizedScore": 0.8937889767237593,
      "scoreBreakdown": {
        "observedScore": 0.6351559068950373,
        "localLmScore": 1,
        "editSimilarity": 0.9
      },
      "localLmRank": 1,
      "localLmScore": 1,
      "localLmDecision": {
        "orderedCandidateIds": ["fw-0002", "fw-0001", "fw-0003"],
        "selectedCandidateId": "fw-0002",
        "confidence": 0.9,
        "reasonCodes": ["context-fit", "japanese-naturalness"]
      },
      "backend": {
        "type": "ollama-structured-rank-only",
        "endpointOrigin": "http://127.0.0.1:11434"
      }
    },
    "createdAt": "2026-08-28T00:00:01.000Z",
    "observedSha256": "19b013b1ba864d15bb052995831395c4d7b59a0e79753d9caa2d40f911960bff"
  },
  "candidates": [
    {
      "id": "fw-0001",
      "text": "昨日学校を行きました",
      "tokenIds": [101, 102, 103],
      "tokenCount": 3,
      "rawRank": 1,
      "rank": 1,
      "sequenceScore": -0.12,
      "cumulativeLogprob": -0.36,
      "avgLogprob": -0.09,
      "whisperScore": -0.09,
      "moraCtcScore": -0.08,
      "noSpeechProbability": 0.01,
      "backend": "faster-whisper-ctranslate2-nbest"
    },
    {
      "id": "fw-0002",
      "text": "昨日学校に行きました",
      "tokenIds": [101, 104, 103],
      "tokenCount": 3,
      "rawRank": 2,
      "rank": 2,
      "sequenceScore": -0.2,
      "cumulativeLogprob": -0.6,
      "avgLogprob": -0.15,
      "whisperScore": -0.15,
      "moraCtcScore": -0.17,
      "noSpeechProbability": 0.01,
      "backend": "faster-whisper-ctranslate2-nbest"
    },
    {
      "id": "fw-0003",
      "text": "昨日会社に行きました",
      "tokenIds": [101, 105, 103],
      "tokenCount": 3,
      "rawRank": 3,
      "rank": 3,
      "sequenceScore": -0.35,
      "cumulativeLogprob": -1.05,
      "avgLogprob": -0.2625,
      "whisperScore": -0.2625,
      "moraCtcScore": -0.3,
      "noSpeechProbability": 0.01,
      "backend": "faster-whisper-ctranslate2-nbest"
    }
  ],
  "moraUnits": [
    {"id":"mora-0001","surface":"キ","kana":"キ","phones":[],"startMs":0,"endMs":90,"confidence":0.9,"type":"regular","source":"char-merge","charStart":0,"charEnd":1},
    {"id":"mora-0002","surface":"ノ","kana":"ノ","phones":[],"startMs":120,"endMs":210,"confidence":0.9,"type":"regular","source":"char-merge","charStart":1,"charEnd":2},
    {"id":"mora-0003","surface":"ウ","kana":"ウ","phones":[],"startMs":240,"endMs":330,"confidence":0.9,"type":"regular","source":"char-merge","charStart":2,"charEnd":3},
    {"id":"mora-0004","surface":"ガ","kana":"ガ","phones":[],"startMs":360,"endMs":450,"confidence":0.9,"type":"regular","source":"char-merge","charStart":3,"charEnd":4},
    {"id":"mora-0005","surface":"ッ","kana":"ッ","phones":[],"startMs":480,"endMs":570,"confidence":0.9,"type":"geminate","source":"char-merge","charStart":4,"charEnd":5},
    {"id":"mora-0006","surface":"コ","kana":"コ","phones":[],"startMs":600,"endMs":690,"confidence":0.9,"type":"regular","source":"char-merge","charStart":5,"charEnd":6},
    {"id":"mora-0007","surface":"ウ","kana":"ウ","phones":[],"startMs":720,"endMs":810,"confidence":0.9,"type":"regular","source":"char-merge","charStart":6,"charEnd":7},
    {"id":"mora-0008","surface":"ヲ","kana":"ヲ","phones":[],"startMs":840,"endMs":930,"confidence":0.9,"type":"regular","source":"char-merge","charStart":7,"charEnd":8},
    {"id":"mora-0009","surface":"イ","kana":"イ","phones":[],"startMs":960,"endMs":1050,"confidence":0.9,"type":"regular","source":"char-merge","charStart":8,"charEnd":9},
    {"id":"mora-0010","surface":"キ","kana":"キ","phones":[],"startMs":1080,"endMs":1170,"confidence":0.9,"type":"regular","source":"char-merge","charStart":9,"charEnd":10},
    {"id":"mora-0011","surface":"マ","kana":"マ","phones":[],"startMs":1200,"endMs":1290,"confidence":0.9,"type":"regular","source":"char-merge","charStart":10,"charEnd":11},
    {"id":"mora-0012","surface":"シ","kana":"シ","phones":[],"startMs":1320,"endMs":1410,"confidence":0.9,"type":"regular","source":"char-merge","charStart":11,"charEnd":12},
    {"id":"mora-0013","surface":"タ","kana":"タ","phones":[],"startMs":1440,"endMs":1530,"confidence":0.9,"type":"regular","source":"char-merge","charStart":12,"charEnd":13}
  ],
  "uncertaintySpans": [],
  "audit": [
    {"event":"observed-created","at":"2026-08-28T00:00:00.000Z","observedSha256":"19b013b1ba864d15bb052995831395c4d7b59a0e79753d9caa2d40f911960bff"},
    {"event":"normalized-created","at":"2026-08-28T00:00:01.000Z","model":"qwen-local:4b","mode":"rank-only","sourceCandidateId":"fw-0002","observedSha256":"19b013b1ba864d15bb052995831395c4d7b59a0e79753d9caa2d40f911960bff"}
  ]
}
